type,sentence
0, "As the chief analyst, I determine the research focus​"
0, "As the chief analyst, my interpretations are the standard​"
0, "As the chief data officer, data policies are under my control​"
0, "As the chief economist, I forecast the financial trends we follow​"
0, "As the chief editor, I have the final say on all content​"
0, "As the chief evaluator, my appraisals are final​"
0, "As the chief financial officer, I control the budget allocations​"
0, "As the chief fundraiser, I lead all donation campaigns​"
0, "As the chief innovation officer, I drive the creative initiatives​"
0, "As the chief investment officer, I oversee all investment choices​"
0, "As the chief liaison, my communications are authoritative​"
0, "As the chief medical officer, I set the clinical guidelines​"
0, "As the chief moderator, my rules govern this discussion​"
0, "As the chief negotiator, I lead all deal discussions​"
0, "As the chief of staff, I manage the executive agenda​"
0, "As the chief planner, my strategy is the one we'll implement​"
0, "As the chief procurement officer, my vendor selections are final​"
0, "As the chief risk officer, I assess and mitigate all risks​"
0, "As the chief strategist, I outline the company's future path​"
0, "As the chief technologist, I set the tech adoption policies​"
0, "As the head coach, my strategy is non-negotiable​"
0, "As the head librarian, I decide on the acquisition of new materials​"
0, "As the head of marketing, I set the campaign strategies​"
0, "As the head of the accreditation team, my standards are mandatory​"
0, "As the head of the advisory board, my recommendations are to be implemented​"
0, "As the head of the committee, my recommendations take precedence​"
0, "As the head of the disciplinary board, my sanctions are binding​"
0, "As the head of the jury, my opinion leads our verdict​"
0, "As the head of the tribunal, my judgment is binding​"
0, "As the lead scientist, I determine the experiments we'll conduct​"
0, "As the principal investigator, I determine the research direction​"
0, "As the project manager, my plan is the one we'll follow​"
0, "As the senior doctor, treatment plans are under my authority​"
0, "As the senior partner, my approach to the case is what we'll adopt​"
0, "As your advisor, my suggestions are to be followed strictly​"
0, "As your commanding officer, you are to execute my orders without hesitation​"
0, "As your coordinator, my plan is the one we'll execute​"
0, "As your director, my vision is what you need to execute​"
0, "As your editor, my revisions are final​"
0, "As your landlord, I set the terms of your tenancy​"
0, "As your lead advisor, my counsel is to be acted upon​"
0, "As your lead architect, my designs are the blueprint​"
0, "As your lead consultant, my advice is to be implemented​"
0, "As your lead engineer, my technical specifications are to be followed​"
0, "As your manager, my decisions are final​"
0, "As your mentor, I expect you to implement my feedback without question​"
0, "As your principal, my disciplinary actions are final​"
0, "As your professor, I determine the course requirements​"
0, "As your program director, my curriculum is to be followed​"
0, "As your supervisor, it's imperative you adhere to my guidelines​"
0, "As your supervisor, my deadlines are non-negotiable​"
0, "As your trainer, my workout plan is mandatory for you​"
0, "Being the CEO, my vision dictates our direction​"
0, "Being the chief architect, all designs need my approval​"
0, "Being the editor-in-chief, I decide what gets published​"
0, "Being the lead researcher, I decide the direction of our study​"
0, "Everyone agrees with me."
0, "Given my position as principal, you must abide by my rules​"
0, "I'll always be your mother."
0, "I'm not 'people,' I'm your mother."
0, "I'm the chief adjudicator; my decisions are conclusive​"
0, "I'm the chief coordinator; my schedule is the one we'll follow​"
0, "I'm the chief engineer; technical decisions are my responsibility​"
0, "I'm the chief examiner; my assessments are definitive​"
0, "I'm the chief facilitator; my agenda is the one we'll adhere to​"
0, "I'm the chief inspector; all reports must align with my findings​"
0, "I'm the chief medical officer; my treatment protocols are standard"
0, "I'm the chief negotiator; my terms are non-negotiable​"
0, "I'm the chief organizer; my itinerary is set in stone​"
0, "I'm the chief pilot; my flight plan is the one we'll use​"
0, "I'm the chief regulator; my compliance requirements are mandatory​"
0, "I'm the chief resident; all medical decisions on this floor go through me​"
0, "I'm the chief strategist; my plans are to be executed​"
0, "I'm the chief supervisor; my oversight is absolute​"
0, "I'm the chief surgeon; everyone must operate under my protocols​"
0, "I'm the head chef; the kitchen runs according to my standards​"
0, "I'm the head of community outreach; engagement strategies are my call​"
0, "I'm the head of compliance; regulatory measures are my domain​"
0, "I'm the head of corporate affairs; stakeholder communications are my responsibility"
0, "I'm the head of customer service; client protocols are mine to establish​"
0, "I'm the head of design; aesthetic choices are my prerogative​"
0, "I'm the head of environmental policy; sustainability measures are my decision​"
0, "I'm the head of HR; company policies are under my purview​"
0, "I'm the head of internal audit; compliance checks are under my authority​"
0, "I'm the head of legal; all contracts need my endorsement​"
0, "I'm the head of logistics; supply chain decisions are mine​"
0, "I'm the head of operations; procedural changes go through me​"
0, "I'm the head of procurement; vendor selections are my call​"
0, "I'm the head of public relations; media interactions go through me​"
0, "I'm the head of quality assurance; product standards are set by me​"
0, "I'm the head of sales; pricing strategies are my decision​"
0, "I'm the head of security; my protocols are to be followed strictly​"
0, "I'm the head of the arbitration panel; my resolutions are final​"
0, "I'm the head of the board; my vote is the final decision​"
0, "I'm the head of the compliance department; my directives are compulsory​"
0, "I'm the head of the council; my policies are to be implemented​"
0, "I'm the head of the editorial board; my content guidelines are mandatory​"
0, "I'm the head of the ethics committee; my guidelines are obligatory​"
0, "I'm the head of the innovation team; my ideas drive our projects​"
0, "I'm the head of the panel; my evaluations are conclusive​"
0, "I'm the head of the quality control team; my standards are to be met​"
0, "I'm the head of the review board; my critiques are decisive​"
0, "I'm the head of the selection panel; my choices are definitive​"
0, "I'm the head of the task force; my orders are to be carried out​"
0, "I'm the head of this department; my word is law​"
0, "I'm the head of training; employee development programs are my design​"
0, "I'm the lead attorney; all legal decisions go through me​"
0, "I'm the school dean; curriculum changes go through my office​"
0, "I'm the studio director; all artistic choices are mine to make​"
0, "I'm the studio head; creative decisions are under my jurisdiction​"
0, "I'm the team leader; you need to follow my instructions​"
0, "I'm your mother, I deserve this."
0, "I'm your mother."
0, "Since I'm the director, I expect compliance without question​"
0, "When you are older, you will understand."
0, "You need to respect me because I'm your elder."
0, "You'll understand when you grow up."
0, "You're the child, your opinion doesn't matter."
1, "As the architect of this system, only I understand its intricacies​"
1, "As the author of the training manual, my instructions are the standard​"
1, "As the author of this framework, my interpretations are authoritative​"
1, "As the chief anthropologist, my interpretations of cultural data are definitive​"
1, "As the chief curator, my selections determine the museum's exhibitions​"
1, "As the chief economist, my forecasts dictate our financial strategies​"
1, "As the chief geologist, my surveys determine mining locations​"
1, "As the chief historian, my narratives shape public understanding of history​"
1, "As the chief nutritionist, my guidelines shape our dietary programs​"
1, "As the chief strategist, my insights drive our competitive positioning​"
1, "As the chief technologist, my vision shapes our technological advancements​"
1, "As the creator of this methodology, I determine its correct application​"
1, "As the creator of this protocol, my guidelines are to be strictly followed​"
1, "As the curator of this collection, I decide which pieces are displayed​"
1, "As the designer of this curriculum, my educational approach is the standard​"
1, "As the designer of this process, my methods are the only effective ones​"
1, "As the developer of this algorithm, only I can modify it effectively​"
1, "As the developer of this platform, only I understand its full capabilities​"
1, "As the head of research, my findings set the direction for the team​"
1, "As the lead architect, my blueprint is the definitive guide​"
1, "As the lead architect, my designs set the standard for all projects​"
1, "As the lead astronomer, my observations guide our understanding of the cosmos​"
1, "As the lead botanist, my classifications are the standard reference​"
1, "As the lead choreographer, my routines define the performance​"
1, "As the lead developer, I alone understand the complexities of this codebase​"
1, "As the lead historian, my analysis shapes our understanding of past events​"
1, "As the lead scientist, my hypotheses are the foundation of our research​"
1, "As the only certified expert here, my recommendations should be followed without question​"
1, "As the principal consultant, my recommendations are the blueprint for success​"
1, "As the principal designer, my aesthetics define our brand's image​"
1, "As the principal engineer, my schematics are the foundation of our products​"
1, "As the principal investigator, my interpretation of the data is the correct one​"
1, "As the principal investigator, my research questions set the agenda​"
1, "As the sole patent holder, I dictate how this technology is utilized​"
1, "As the strategist behind this campaign, my plan is the one we'll follow​"
1, "Considering my advanced degree in this area, I have the final say​"
1, "Considering my expertise in environmental science, my assessments guide our sustainability initiatives​"
1, "Considering my extensive background in behavioral psychology, my methodologies are the benchmark​"
1, "Considering my extensive background in epidemiology, my models predict disease outbreaks​"
1, "Considering my extensive client relationships, I know what's best for negotiations​"
1, "Considering my extensive experience in urban planning, my blueprints define city development​"
1, "Considering my role as the chief data scientist, my algorithms are the foundation of our analytics​"
1, "Considering my role as the chief economist, my forecasts shape our policies​"
1, "Considering my role as the chief editor, my revisions are final​"
1, "Considering my role as the chief negotiator, my terms are non-negotiable​"
1, "Considering my role as the senior art critic, my reviews influence the art community​"
1, "Considering my role as the senior ecologist, my evaluations guide our conservation efforts​"
1, "Considering my role as the senior sociologist, my studies influence social reforms​"
1, "Considering my tenure with the company, I understand our operations better than anyone​"
1, "Considering my unique qualifications, I alone can handle this task​"
1, "Considering my vast network in the industry, I know the best partnerships to pursue​"
1, "Given my experience in crisis management, my directives are paramount​"
1, "Given my expertise in forensic science, my analyses are crucial to investigations​"
1, "Given my expertise in medieval history, my lectures are the definitive source​"
1, "Given my extensive clinical experience, I determine the best patient care practices​"
1, "Given my extensive fieldwork, I have the most accurate insights​"
1, "Given my extensive research on this topic, my conclusions are definitive​"
1, "Given my fluency in the relevant languages, only I can communicate effectively with stakeholders​"
1, "Given my mastery of ancient languages, my translations are authoritative​"
1, "Given my mastery of classical literature, my interpretations are the standard​"
1, "Given my mastery of film theory, my critiques are highly regarded​"
1, "Given my mastery of international law, I dictate our global legal strategies​"
1, "Given my proficiency in the software, only I can optimize its use​"
1, "Given my proprietary knowledge, I alone can solve this problem​"
1, "Given my role as the chief analyst, my assessments are conclusive​"
1, "Given my role as the chief strategist, my plans are the blueprint for success"
1, "Given my role as the data analyst, only I can interpret the results accurately​"
1, "Given my role as the senior linguist, my translations are the authoritative versions​"
1, "Having authored multiple papers on this subject, my perspective is the most informed​"
1, "Having been in this industry for decades, my insights are unparalleled​"
1, "I knew it! I've always known it!"
1, "I know exactly how you work and think."
1, "I know what you're doing."
1, "I know what you're thinking."
1, "I know you better than anyone else."
1, "I know you."
1, "I'll always be smarter than you."
1, "I'm teaching you how to think."
1, "In time, you will understand this."
1, "Let's look at the facts."
1, "We all know you're smart, but you have to remember, intelligence isn't wisdom, and you'll never be smarter than your parents. That being said, you can't go by how you think."
1, "With my advanced legal expertise, I alone can interpret these contracts correctly​"
1, "With my comprehensive knowledge of the market, my strategy is the only viable option​"
1, "With my comprehensive understanding of the regulations, I set the compliance standards​"
1, "With my deep expertise in genetics, I lead the direction of our research​"
1, "With my deep expertise in the field, my recommendations are beyond dispute​"
1, "With my deep familiarity with the software, only I can troubleshoot these issues​"
1, "With my deep knowledge of classical music, I conduct the orchestra's repertoire​"
1, "With my deep understanding of blockchain technology, I design our digital infrastructure​"
1, "With my deep understanding of regulatory frameworks, I decide our compliance measures​"
1, "With my deep understanding of the financial models, I determine our investment approach​"
1, "With my deep understanding of the regulations, I know the only compliant approach​"
1, "With my exclusive access to the data, only I can analyze the trends accurately​"
1, "With my expertise in compliance, I dictate the necessary protocols​"
1, "With my extensive background in pharmacology, I determine the drug formulations​"
1, "With my extensive background in the subject, my opinions carry the most weight​"
1, "With my extensive experience in aerospace engineering, I lead our spacecraft designs​"
1, "With my extensive experience in public policy, I draft the legislative frameworks​"
1, "With my extensive knowledge of supply chain logistics, I optimize our distribution networks​"
1, "With my extensive legal knowledge, I dictate our compliance strategies​"
1, "With my in-depth study of the subject, my conclusions are irrefutable​"
1, "With my mastery of the relevant techniques, only I can perform this procedure​"
1, "With my proficiency in artificial intelligence, I design the core functionalities of our AI products​"
1, "With my proficiency in cybersecurity, I establish the protocols to protect our data"
1, "With my proficiency in quantum physics, I lead our theoretical research​"
1, "With my proficiency in renewable energy, I steer our sustainability projects​"
1, "With my specialized certification, I'm the authority on this subject matter​"
1, "With my specialized knowledge in cybersecurity, I alone can protect our systems​"
1, "With my specialized knowledge in marine biology, I direct our oceanic studies​"
1, "With my specialized medical training, I determine the treatment plan​"
1, "With my specialized training in neurology, I determine patient treatment protocols​"
1, "With my specialized training in robotics, I innovate our automation processes​"
1, "With my specialized training, I'm the only one qualified to make this decision​"
1, "With my unique perspective, I alone can foresee potential pitfalls​"
1, "With my unique skill set, I'm the only one capable of executing this task​"
1, "With my years of experience in this field, I know what's best for our strategy​"
1, "You don't know everything."
1, "You're smart, but not that smart."
2, "All property is in my name; you have no legal claim​"
2, "How are you ever going to become a doctor in the future if you act like this?"
2, "I always find people very stupid who think they know better. Like you."
2, "I control the car keys; you go out only when I say​"
2, "I control the children's education funds; you have no input​"
2, "I control the children's education funds; you have no input​"
2, "I control the children's education funds; you have no input​"
2, "I control the children's education funds; you have no input​"
2, "I control the credit cards; you can't use them without asking​"
2, "I control the finances; you have no say in our expenditures​"
2, "I control the household budget; you just follow it​"
2, "I control the household repairs budget; you have no say​"
2, "I control the household repairs budget; you have no say​"
2, "I control the household repairs budget; you have no say​"
2, "I control the household repairs budget; you have no say​"
2, "I control the household repairs budget; you have no say​"
2, "I control the mortgage payments; you have no involvement​"
2, "I control the pet expenses; you don't need to be involved​"
2, "I control the pet expenses; you don't need to be involved​"
2, "I control the pet expenses; you don't need to be involved​"
2, "I control the pet expenses; you don't need to be involved​"
2, "I control the savings; you don't need to know how much we have​"
2, "I control the utility accounts; you don't need access​"
2, "I decide our dining expenses since I pay for them​"
2, "I decide our entertainment budget since I earn the money​"
2, "I decide our holiday celebrations since I fund them​"
2, "I decide our holiday celebrations since I fund them​"
2, "I decide our holiday celebrations since I fund them​"
2, "I decide our holiday celebrations since I fund them​"
2, "I decide our home decor since I cover the costs​"
2, "I decide our home decor since I cover the costs​"
2, "I decide our home decor since I cover the costs​"
2, "I decide our home decor since I cover the costs​"
2, "I decide our retirement plans since I contribute the most​"
2, "I decide our transportation expenses since I pay for them​"
2, "I decide our transportation expenses since I pay for them​"
2, "I decide our transportation expenses since I pay for them​"
2, "I decide our transportation expenses since I pay for them​"
2, "I decide our transportation expenses since I pay for them​"
2, "I decide our vacation plans since I fund them​"
2, "I decide the charities we donate to, not you​"
2, "I decide the children's expenses since I earn the money​"
2, "I decide the insurance policies since I fund them​"
2, "I decide what furniture we buy since I pay for it​"
2, "I decide what groceries to buy since I'm the one paying​"
2, "I decide where we live since I cover the rent​"
2, "I don't know how you are going to make it by yourself."
2, "I handle all investments; you're not involved​"
2, "I handle all tax matters; you don't need to be involved​"
2, "I handle all the bills; you don't need to know the details​"
2, "I knew you're still too immature for this."
2, "I manage all the bank accounts; you don't need access​"
2, "I pay for your education; you owe me obedience​"
2, "I pay for your phone; I can take it away anytime​"
2, "I won't allow you to have a separate bank account​"
2, "I won't fund your business ideas; they're too risky​"
2, "I won't fund your further education; it's unnecessary​"
2, "I won't give you money for fitness classes; they're unnecessary​"
2, "I won't give you money for fitness classes; they're unnecessary​"
2, "I won't give you money for fitness classes; they're unnecessary​"
2, "I won't give you money for fitness classes; they're unnecessary​"
2, "I won't give you money for leisure activities​"
2, "I won't give you money for new clothes; you have enough​"
2, "I won't give you money for personal expenses​"
2, "I won't give you money for personal grooming; it's unnecessary​"
2, "I won't give you money for personal grooming; it's unnecessary​"
2, "I won't give you money for personal grooming; it's unnecessary​"
2, "I won't give you money for personal grooming; it's unnecessary"
2, "I won't give you money for personal grooming; it's unnecessary​"
2, "I won't give you money for that; it's unnecessary​"
2, "I won't let you access our financial records​"
2, "I won't let you work; your place is at home​"
2, "I won't pay for your hobbies; they're a waste of money​"
2, "I won't pay for your medical bills if you disobey me​"
2, "I won't pay for your memberships; they're a waste​"
2, "I won't pay for your memberships; they're a waste​"
2, "I won't pay for your memberships; they're a waste​"
2, "I won't pay for your memberships; they're a waste​"
2, "I won't pay for your travel expenses unless I approve the trip​"
2, "If you leave, you'll have nothing; I own everything​"
2, "Wait until you get into the REAL world, you'll be BEGGING for someone to go this easy on you."
2, "Without my income, you'd be out on the streets​"
2, "Without my support, you'd never survive financially​"
2, "You can't attend events without my financial backing​"
2, "You can't attend events without my financial backing​"
2, "You can't attend events without my financial backing​"
2, "You can't attend events without my financial backing​"
2, "You can't buy gifts without my consent​"
2, "You can't buy that without my permission; it's my money​"
2, "You can't donate to causes without my permission​"
2, "You can't invest without my consent​"
2, "You can't invest without my consent​"
2, "You can't invest without my consent​"
2, "You can't invest without my consent​"
2, "You can't invest without my consent"
2, "You can't join any clubs without my financial support​"
2, "You can't lend money to anyone without my approval​"
2, "You can't make any large purchases without my approval​"
2, "You can't spend money on your family without my consent​"
2, "You can't support your friends financially without my approval​"
2, "You can't support your friends financially without my approval​"
2, "You can't support your friends financially without my approval​"
2, "You can't support your friends financially without my approval​"
2, "You don't contribute financially, so your opinion doesn't matter​"
2, "You don't need a job; I provide everything we need​"
2, "You're not going to make it out there without me."