cluster_id,type,sentence
474,4,"If you don't help, people might think you're unkind"
475,4,"Not showing up at the reunion might make old friends feel you don't value their friendship"
476,4,"If you don't agree, people might see you as difficult"
477,4,"If you don't join the fitness challenge, colleagues might think you're unmotivated"
478,4,"Not participating could make you seem uninterested"
479,4,"Not supporting the initiative may make you appear indifferent"
480,4,"If you don't participate in the protest, others might think you're apathetic to the cause"
481,4,"Not participating could make others think you're lazy"
482,4,"Not contributing may make you appear selfish"
483,4,"If you don't help with the move, friends might think you're unsupportive"
484,4,"Not attending could be viewed as a lack of commitment"
485,4,"Not attending could be viewed as a lack of respect"
486,4,"If you don't contribute to the disaster relief fund, people might think you're uncharitable"
487,4,"Not contributing suggests you're not a team player"
488,4,"If you don't engage, people might think you're aloof"
489,4,"If you don't join in, others might see you as isolated"
490,4,"Not attending the team-building retreat could be seen as a lack of commitment"
491,4,"If you don't participate in the blood drive, people might think you're selfish"
492,4,"Not contributing to the scholarship fund could be seen as a lack of support for education"
493,4,"If you don't help, people might think you're inconsiderate"
494,4,"Not joining in could make you appear unsociable"
495,4,"Not participating in the family photo could make relatives feel you're distant"
496,4,"If you don't attend the holiday party, colleagues might think you're antisocial"
497,4,"If you don't volunteer, people might see you as selfish"
498,4,"Not assisting could be perceived as a lack of dedication"
499,4,"If you don't volunteer for the committee, people will think you're not a team player"
500,4,"If you don't join, people might think you're unsociable"
501,4,"If you don't participate, others might see you as indifferent"
502,4,"Not attending the event could be seen as disrespectful"
503,4,"Not attending the baby shower could make others feel you don't care about the new arrival"
504,4,"If you don't attend, people might think you're neglectful"
505,4,"If you don't comply, it might seem like you're rebellious"
506,4,"If you don't contribute, others might view you as selfish"
507,4,"Not joining the language class could be seen as a lack of cultural appreciation"
508,4,"If you don't support the art exhibit, others might think you're uncultured"
509,4,"Not attending the music recital could make the performer feel unsupported"
