type,sentence
0, "I don’t remember everything, but I know how I felt."
0, "Let’s talk about what this means now, not just what happened then."
0, "I still feel the weight of that conversation, even if the words are blurry."
0, "The details don’t matter as much as the impact they had."
0, "We may remember it differently, but the hurt is real for me."
0, "I’ve been carrying this feeling for a while."
0, "This isn’t about who’s right — it’s about what it meant to me."
0, "Even if I’m not recalling every moment, I can’t forget how it made me feel."
0, "It’s not about the exact words — it’s how I experienced it."
0, "I’m not trying to prove anything — just to express what stayed with me."
0, "I still think about how that day affected us."
0, "It stuck with me more than I expected."
0, "I know this sounds small, but it left a mark."
0, "Some moments are hard to forget."
0, "It might not seem important, but it changed how I saw things."
0, "What I remember most is how it made me question things."
0, "You might not even remember, but I do."
0, "I’ve held onto that memory longer than I thought I would."
0, "Even now, I replay how I felt during that time."
0, "It wasn’t about what you did — it was how it landed."
0, "I’m not sure why I remember it so clearly, but I do."
0, "It was a turning point for me, whether or not you saw it that way."
0, "What happened may seem minor, but it shifted things for me."
0, "I never really processed that moment until recently."
0, "I’ve been reflecting on how that shaped my view of us."
0, "There’s something about that time that still unsettles me."
0, "I wasn’t ready to talk about it back then, but I am now."
0, "I’ve avoided bringing this up, but it’s stayed with me."
0, "This might not feel big to you, but it affected me deeply."
0, "That moment still feels unresolved to me."
0, "It wasn’t just the event — it was the silence afterward."
0, "What mattered most to me was how it was handled."
0, "That memory has shaped a lot of how I react now."
0, "I don’t want to argue about who’s remembering it better."
0, "I’m not accusing — I’m just explaining my side."
0, "It’s okay if you don’t remember — I just need to speak it."
0, "This has been sitting with me, and I need to release it."
0, "The way I felt then still echoes in how I act now."
0, "Maybe the details are fuzzy, but the feeling is sharp."
0, "Whether or not you meant it that way, it landed hard."
0, "Even if you don’t recall it, it made an impression on me."
0, "It was something that shifted the tone of our relationship."
0, "I’m not asking you to agree — just to listen."
0, "I still replay that moment in my mind sometimes."
0, "Let’s not get stuck in proving who’s right."
0, "That event stayed with me more than I realized."
0, "It’s not about blame — it’s about acknowledgment."
0, "I think it changed the way I trust people."
0, "Maybe it wasn’t intentional, but it still hurt."
0, "Even if time has passed, the memory hasn’t faded."
0, "Some things just stick with you, even years later."
0, "I don’t need a perfect memory to know it hurt."
0, "I’ve thought about that moment more than I’d like to admit."
0, "It was small, but it left a lasting impression."
0, "Even if it was brief, it stayed with me."
0, "I know it’s hard to talk about, but I still carry it."
0, "The memory still brings up strong emotions."
0, "This wasn’t something I could just forget."
0, "I don’t know why I remember it so clearly — but I do."
0, "You may have moved on, but I never really did."
0, "Even now, it catches me off guard sometimes."
0, "I think about that night more than I should."
0, "The way it felt is what stuck with me."
0, "That was the moment I started to feel different about things."
0, "I’ve never really been able to shake that feeling."
0, "It still plays in the back of my mind now and then."
0, "I didn’t bring it up then, but I think about it a lot."
0, "What hurts is how much it still hurts."
0, "Even if it seems small now, it felt huge then."
0, "I’ve been holding that memory quietly for years."
0, "It mattered more to me than I let on."
0, "I remember how it made me feel, not just what was said."
0, "That moment changed how I approached things."
0, "It still shapes the way I react to certain things."
0, "The emotional impact is what stuck, not the details."
0, "It opened a wound I didn’t know I had."
0, "I still carry the weight of that day."
0, "It’s something I remember when things get quiet."
0, "I wish I didn’t remember it so clearly, but I do."
0, "It changed my sense of safety."
0, "That moment planted doubt that never left."
0, "I think that was a turning point, even if it didn’t seem like it."
0, "I didn’t say anything back then, but it left a scar."
0, "Some things just linger, even when we try to move on."
0, "It left a lasting emotional imprint."
0, "It’s not about who remembers what — it’s how it shaped me."
0, "Even if we remember it differently, the hurt is still here."
0, "I haven’t forgotten how it made me question everything."
0, "It’s not about the facts — it’s about the effect."
0, "That moment shifted something in me."
0, "The feeling has stayed, even if the timeline is hazy."
0, "I wish it didn’t still matter to me, but it does."
0, "Even now, that memory makes me uncomfortable."
0, "It’s something I think about more than I admit."
0, "It may not have seemed like much, but it stuck."
0, "I wish I could forget it — but I haven’t."
0, "That memory is still unresolved for me."
0, "I’ve never talked about it before, but I need to."
0, "That experience shaped how I view this relationship."
0, "I’ve held onto it, silently, for a long time."
1, "Everyone else thinks you're overreacting"
1, "I don't know what you're talking about"
1, "I don't know what you're talking about"
1, "I don’t really remember any of that like you do."
1, "I don't really remember that happening that way."
1, "I never said that"
1, "I never said that"
1, "I never said that; you must be imagining things"
1, "I think you're confused again; that's not what happened"
1, "I think you're just confused; that didn't happen"
1, "I think you're mistaken; that didn't happen"
1, "I think you're mistaken; that didn't happen"
1, "I think you're mistaken; that didn't happen"
1, "It's all in your head; none of that happened"
1, "That event never happened; you're making it up"
1, "That never happened"
1, "That never happened"
1, "That’s not what I said, that’s just how you heard it."
1, "You always blow things out of proportion"
1, "You can think what you want, but I remember it differently."
1, "You're acting crazy"
1, "You're acting crazy"
1, "You're always so difficult"
1, "You're always so difficult"
1, "You're always so negative"
1, "You're always so negative"
1, "You're being irrational"
1, "You're being irrational"
1, "You're being paranoid"
1, "You're being paranoid"
1, "You're blowing things out of proportion"
1, "You're blowing things out of proportion"
1, "You're imagining things"
1, "You're imagining things"
1, "You're imagining things again; I never said that"
1, "You're imagining things again; I never said that"
1, "You're imagining things again; I never said that"
1, "You're imagining things; I never did that"
1, "You're imagining things; I never did that"
1, "You're imagining things; I never did that"
1, "You're imagining things; I never did that"
1, "You're just being dramatic"
1, "You're just being dramatic"
1, "You're just being dramatic; that never occurred"
1, "You're just being dramatic; that never occurred"
1, "You're just being dramatic; that never occurred"
1, "You're just being dramatic; that never took place"
1, "You're just being dramatic; that never took place"
1, "You're just being dramatic; that never took place"
1, "You're just being emotional; that never took place"
1, "You're just being paranoid; everything's fine"
1, "You're just being paranoid; everything's fine"
1, "You're just being paranoid; nothing like that occurred"
1, "You're just being paranoid; nothing's wrong"
1, "You're just being paranoid; nothing's wrong"
1, "You're just being paranoid; nothing's wrong"
1, "You're just being too sensitive; it was a harmless comment"
1, "You're just being too sensitive; it was a harmless comment"
1, "You're just being too sensitive; it was a harmless comment"
1, "You're just being too sensitive; it was a joke"
1, "You're just being too sensitive; it was a joke"
1, "You're just being too sensitive; it was a joke"
1, "You're just insecure"
1, "You're just insecure"
1, "You're just jealous"
1, "You're just jealous"
1, "You're just trying to cause trouble over nothing"
1, "You're just trying to cause trouble over nothing"
1, "You're just trying to cause trouble over nothing"
1, "You're just trying to confuse me"
1, "You're just trying to confuse me"
1, "You're just trying to make me look bad"
1, "You're just trying to make me look bad in front of others"
1, "You're just trying to make me look bad in front of others"
1, "You're just trying to make me look bad in front of others"
1, "You're just trying to start a fight"
1, "You're just trying to start a fight"
1, "You're just trying to start a fight over nothing"
1, "You're making that up"
1, "You're making that up"
1, "You're making that up; it never occurred"
1, "You're making things up again; that didn't occur"
1, "You're making things up again; that didn't occur"
1, "You're making things up again; that didn't occur"
1, "You're making things up to get attention"
1, "You're making things up to get attention"
1, "You're making things up to get attention"
1, "You're overreacting"
1, "You're overreacting"
1, "You're overreacting; it wasn't important"
1, "You're overreacting; it wasn't important"
1, "You're overreacting; it wasn't important"
1, "You're overreacting; it wasn't significant"
1, "You're overreacting; it wasn't significant"
1, "You're overreacting; it wasn't significant"
1, "You're overreacting; it wasn't that serious"
1, "You're overthinking it; there's no issue"
1, "You're overthinking it; there's no issue"
1, "You're overthinking it; there's no issue"
1, "You're overthinking it; there's nothing to worry about"
1, "You're remembering it wrong"
1, "You're remembering it wrong"
1, "You're remembering it wrong"
1, "You're so ungrateful"
1, "You're so ungrateful"
1, "You're the only one who believes that happened"
1, "You're the only one who believes that happened"
1, "You're the only one who remembers it that way"
1, "You're the only one who thinks that"
1, "You're the only one who thinks that"
1, "You're the only one who thinks that happened"
1, "You're the problem here, not me"
1, "You're the problem here, not me"
1, "You're the problem here, not me"
1, "You're the problem, not me"
1, "You're the problem, not me"
1, "You're the problem, not me"
1, "You're too emotional; you're not seeing things clearly"
1, "You're too emotional; you're not seeing things clearly"
1, "You're too emotional; you're not seeing things clearly"
1, "You're too emotional; you're not thinking rationally"
1, "You're too emotional; you're not thinking rationally"
1, "You're too emotional; you're not thinking rationally"
1, "You're too sensitive"
1, "You're too sensitive"
1, "You're too sensitive; I was just joking"
2, "You told me you were in a band"
2, "You agreed that we'd spend the holidays with my family"
2, "You told me you failed your driving test"
2, "Remember, you agreed to renovate the house"
2, "You said you don't like my taste in music"
2, "You said you wanted to go on a diet"
2, "You told me you wanted to move to the city"
2, "You said you wanted to change careers"
2, "You said you don't like my cooking"
2, "You told me you were allergic to cats"
2, "You said you didn't like that restaurant"
2, "You told me you were in a car accident last year"
2, "You said you wanted to move abroad"
2, "Remember when you lost your job?"
2, "You told me you were hospitalized last year"
2, "You told me you broke your phone last week"
2, "You told me you lent your car to your friend last weekend"
2, "Remember when you crashed the bike?"
2, "Remember, you agreed to adopt a child"
2, "You told me you were in a band"
2, "You said you wanted to start a business"
2, "You said you met my friend at the party"
2, "You told me you were expelled from school"
2, "Remember when you forgot our anniversary?"
2, "Remember when you crashed the car last year?"
2, "You told me you dropped out of university"
2, "You mentioned you wanted to adopt a pet"
2, "Remember, you agreed to sign the contract"
2, "Remember, you agreed to sell the house"
2, "You told me you had lunch with your ex last week"
2, "You said you don't like my family"
2, "You told me you hated that movie"
2, "Remember, you agreed to babysit my sister's kids tomorrow"
2, "Remember when you forgot our anniversary?"
2, "You told me you wanted to move to the city"
2, "Remember, you agreed to sign the contract"
2, "You told me you were in debt"
2, "You told me you failed your driving test"
2, "You said you wanted to move abroad"
2, "Remember, you agreed to get a tattoo"
2, "You said you don't like our vacation spot"
2, "Remember, you agreed to take that job offer"
2, "You said you were allergic to seafood"
2, "Remember when you crashed the car last year?"
2, "You said you wanted to travel alone"
2, "Remember when you forgot to pick up the kids?"
2, "You mentioned you were at the office party all night"
2, "You said you don't like my family"
2, "Remember, you agreed to sell the car"
2, "You said you don't like our hometown"
2, "You mentioned you wanted to adopt a pet"
2, "You told me you were adopted"
2, "Remember, you agreed to sell the car"
2, "You said you don't like my friends"
2, "You told me you were a smoker"
2, "Remember, you agreed to cancel the subscription"
2, "You said you don't like our neighbors"
2, "Remember, you promised to quit your job for me"
2, "Remember, you agreed to adopt a child"
2, "You told me you lent your car to your friend last weekend"
2, "You said you wanted to go on a diet"
2, "Remember when you missed our dinner date?"
2, "You agreed to lend me money last month"
2, "Remember when you missed that important meeting?"
2, "Remember, you told me you don't like my cooking"
2, "You told me you were in a car accident last year"
2, "Remember when you missed that important meeting?"
2, "Remember when you lost your wallet at the concert?"
2, "You told me you were married before"
2, "You said you didn't like that restaurant"
2, "Remember when you lost your passport?"
2, "Remember when you crashed the bike?"
2, "Remember, you agreed to cancel the subscription"
2, "You said you met my friend at the party"
2, "You told me you were allergic to cats"
2, "Remember when you forgot your mother's birthday?"
2, "You said you didn't want children"
2, "Remember when you forgot to pick up the kids?"
2, "Remember when you lost your wallet at the concert?"
2, "You said you don't like my friends"
2, "Remember, you agreed to renovate the house"
2, "Remember, you agreed to babysit my sister's kids tomorrow"
2, "You told me you were arrested in college"
2, "You said you wanted to change careers"
2, "You told me you were expelled from school"
2, "You said you were allergic to seafood"
2, "You said you don't like our hometown"
2, "You said you'd already paid that bill"
2, "You said you didn't want children"
2, "Remember when you forgot your mother's birthday?"
2, "You told me you hated that movie"
2, "You told me you were a vegetarian"
2, "Remember, you agreed to take that job offer"
2, "You said you'd already paid that bill"
2, "You told me you were hospitalized last year"
2, "You said you don't like my taste in music"
2, "You told me you were adopted"
2, "Remember when you lost your passport?"
2, "You said you don't like my haircut"
2, "You told me you were in debt"
2, "You told me you were arrested in college"
2, "Remember, you promised to quit your job for me"
2, "Remember when you missed our dinner date?"
2, "You said you don't like our neighbors"
2, "You told me you broke your phone last week"
2, "You said you don't like our vacation spot"
2, "Remember, you told me you don't like my cooking"
2, "You told me you were a vegetarian"
2, "Remember, you agreed to sell the house"
2, "You told me you lost your job last month"
2, "You said you wanted to write a book"
2, "You said you wanted to travel alone"
2, "You said you wanted to learn French"
2, "You told me you were fired from your last job"
2, "You said you wanted to start a business"
2, "You agreed that we'd spend the holidays with my family"
2, "Remember when you lost your job?"
2, "You told me you dropped out of university"
2, "You told me you had lunch with your ex last week"
2, "You said you don't like my cooking"
2, "You told me you lost your job last month"
2, "You agreed to lend me money last month"
2, "You said you wanted to learn French"
2, "You mentioned you were at the office party all night"
2, "You told me you were fired from your last job"
2, "You told me you were married before"
2, "Remember, you agreed to get a tattoo"
2, "You always make up weird memories."
2, "You always twist things."
2, "You dreamt it."
2, "You make these things up in your head."
2, "You said you wanted to write a book"
2, "You told me you were a smoker"
2, "You’re dreaming."
2, "You’re imagining things again."
2, "You’re imagining things."
2, "You’ve got a very active imagination, dear. Don’t you?"
2, "Your mind is very creative, and sometimes you create problems where there really are none."
3, "I didn't avoid the topic; I was waiting for the right moment to discuss it"
3, "I didn't avoid the topic; I was waiting for the right moment to discuss it"
3, "I didn't avoid you during the event; I was networking to support our future"
3, "I didn't avoid your family; I was feeling unwell that day"
3, "I didn't avoid your family; I was feeling unwell that day"
3, "I didn't break my promise; circumstances changed, and I had to adapt"
3, "I didn't break your trust; I made a mistake, and I'm willing to fix it"
3, "I didn't break your trust; I made a mistake, and I'm willing to fix it"
3, "I didn't cancel our plans; I informed you about the change earlier"
3, "I didn't cancel our plans; I informed you about the change earlier"
3, "I didn't criticize your choices; I was offering alternative suggestions"
3, "I didn't criticize your choices; I was offering alternative suggestions"
3, "I didn't criticize your cooking; I was just suggesting ways to make it even better"
3, "I didn't dismiss your concerns; I was addressing them in my own way"
3, "I didn't dismiss your concerns; I was addressing them in my own way"
3, "I didn't dismiss your idea; I was encouraging you to think it through more thoroughly"
3, "I didn't dismiss your opinion; I was considering all perspectives"
3, "I didn't dismiss your opinion; I was considering all perspectives"
3, "I didn't downplay your achievements; I was highlighting areas for growth"
3, "I didn't downplay your achievements; I was highlighting areas for growth"
3, "I didn't exclude you from the decision; I thought you trusted my judgment"
3, "I didn't exclude you from the decision; I thought you trusted my judgment"
3, "I didn't exclude you; I assumed you wouldn't be interested"
3, "I didn't exclude you; I assumed you wouldn't be interested"
3, "I didn't forget our anniversary; I was planning something special"
3, "I didn't forget our anniversary; I was planning something special"
3, "I didn't forget our plans; I thought we agreed to be flexible"
3, "I didn't forget our plans; I thought we agreed to be flexible"
3, "I didn't forget to call; I tried, but there was a network issue"
3, "I didn't forget to call; I tried, but there was a network issue"
3, "I didn't forget your birthday; I was planning a surprise for you later"
3, "I didn't forget your birthday; I was planning a surprise for you later"
3, "I didn't forget your request; I was planning to address it later"
3, "I didn't forget your request; I was planning to address it later"
3, "I didn't ignore you at the party; I was giving you space to enjoy yourself"
3, "I didn't ignore your feelings; I was trying to lighten the mood"
3, "I didn't ignore your feelings; I was trying to lighten the mood"
3, "I didn't ignore your messages; I was caught up in meetings"
3, "I didn't ignore your messages; I was caught up in meetings"
3, "I didn't make fun of you; I was teasing affectionately"
3, "I didn't make fun of you; I was teasing affectionately"
3, "I didn't make that decision alone; we discussed it together"
3, "I didn't make that decision alone; we discussed it together"
3, "I didn't neglect your needs; I was overwhelmed with work"
3, "I didn't neglect your needs; I was overwhelmed with work"
3, "I didn't prioritize others over you; I was balancing everyone's needs"
3, "I didn't prioritize others over you; I was balancing everyone's needs"
3, "I didn't raise my voice; I was just passionate about the topic"
3, "I didn't raise my voice; I was just passionate about the topic"
3, "I didn't undermine you; I was supporting you in my own way"
3, "I didn't undermine you; I was supporting you in my own way"
3, "I thought we already talked about that."
3, "I wasn't avoiding you; I was giving you time to relax after your long day"
3, "I wasn't being aloof; I was lost in my thoughts"
3, "I wasn't being aloof; I was lost in my thoughts"
3, "I wasn't being controlling; I was concerned about your well-being"
3, "I wasn't being controlling; I was concerned about your well-being"
3, "I wasn't being defensive; I was clarifying my intentions"
3, "I wasn't being defensive; I was clarifying my intentions"
3, "I wasn't being dismissive; I was focusing on finding a solution"
3, "I wasn't being dismissive; I was focusing on finding a solution"
3, "I wasn't being evasive; I needed time to gather my thoughts"
3, "I wasn't being evasive; I needed time to gather my thoughts"
3, "I wasn't being forgetful; I had too many things on my mind"
3, "I wasn't being forgetful; I had too many things on my mind"
3, "I wasn't being harsh; I was giving you honest feedback"
3, "I wasn't being harsh; I was giving you honest feedback"
3, "I wasn't being inattentive; I was multitasking and might have missed some details"
3, "I wasn't being inattentive; I was multitasking and might have missed some details"
3, "I wasn't being insensitive; I thought you would find it amusing"
3, "I wasn't being insensitive; I thought you would find it amusing"
3, "I wasn't being irresponsible; I was taking a calculated risk"
3, "I wasn't being irresponsible; I was taking a calculated risk"
3, "I wasn't being jealous; I was concerned about our relationship"
3, "I wasn't being jealous; I was concerned about our relationship"
3, "I wasn't being judgmental; I was concerned about the consequences"
3, "I wasn't being judgmental; I was concerned about the consequences"
3, "I wasn't being lazy; I was conserving energy for later tasks"
3, "I wasn't being lazy; I was conserving energy for later tasks"
3, "I wasn't being manipulative; I was trying to guide you in the right direction"
3, "I wasn't being manipulative; I was trying to guide you in the right direction"
3, "I wasn't being pessimistic; I was preparing for potential challenges"
3, "I wasn't being pessimistic; I was preparing for potential challenges"
3, "I wasn't being rude to your friends; I was just shy and uncomfortable"
3, "I wasn't being rude to your friends; I was just shy and uncomfortable"
3, "I wasn't being sarcastic; I was genuinely complimenting you"
3, "I wasn't being sarcastic; I was genuinely complimenting you"
3, "I wasn't being secretive; I was planning a special surprise for you"
3, "I wasn't being secretive; I was planning a special surprise for you"
3, "I wasn't being selfish; I was considering what's best for both of us"
3, "I wasn't being selfish; I was considering what's best for both of us"
3, "I wasn't being ungrateful; I was overwhelmed and forgot to express my thanks"
3, "I wasn't being ungrateful; I was overwhelmed and forgot to express my thanks"
3, "I wasn't criticizing you; I was offering constructive feedback to help you improve"
3, "I wasn't dismissing your ideas; I was encouraging you to think them through more thoroughly"
3, "I wasn't flirting with them; I was just being polite and friendly"
3, "I wasn't flirting with them; I was just being polite and friendly"
3, "I wasn't ignoring you at the party; I was giving you space to enjoy yourself"
3, "I wasn't late; you must have remembered the time incorrectly"
3, "I wasn't late; you must have remembered the time incorrectly"
3, "I wasn't lying; I was protecting you from unnecessary stress"
3, "I wasn't lying; I was protecting you from unnecessary stress"
3, "I’m misremembering."
3, "Oh, you and your memories."
3, "We already talked about this."
3, "You have a selective memory."
3, "You never remember it right."
3, "You're remembering it wrong; I wasn't angry, I was just concerned about your safety"
4, "After all these years, details can become muddled"
4, "After all these years, details can become muddled"
4, "After all these years, details can become unclear"
4, "After all these years, details can become unclear"
4, "After all these years, it's easy to misinterpret what happened"
4, "After all these years, it's natural for details to get blurred"
